{
  "schema": "underlay.migration.promotion_ci_guard.v1",
  "schema_version": 1,
  "generated_at": "2026-03-02T21:14:38.748Z",
  "status": "passed",
  "reason_count": 0,
  "reasons": [],
  "files": {
    "decision_file": "/Users/betterthanclay/Dev/projects/underlay/runtime/promotion-guard-smoke/metadata/acowtancy.demo.2026-03-02.promotion-decision.json",
    "lint_file": "/Users/betterthanclay/Dev/projects/underlay/runtime/promotion-guard-smoke/metadata/acowtancy.demo.2026-03-02.promotion-decision-lint.json",
    "release_note_file": "/Users/betterthanclay/Dev/projects/underlay/runtime/promotion-guard-smoke/metadata/acowtancy.demo.2026-03-02.promotion-release-note.json",
    "guard_file": "/Users/betterthanclay/Dev/projects/underlay/runtime/promotion-guard-smoke/metadata/acowtancy.demo.2026-03-02.promotion-ci-guard.json"
  }
}
